subject,topic,difficulty,question_text,explanation,option_1,option_2,option_3,option_4,correct_option
Mathematics,Algebra,Easy,What is the value of 5 + 7?,5 + 7 = 12,10,11,12,14,3
English Language,Grammar,Easy,Which word is a noun?,A noun names a person place or thing,Quickly,Table,Under,Very,2
Basic Science,Living Things,Easy,Which of these animals lays eggs?,Birds lay eggs,Goat,Dog,Hen,Cow,3
Social Studies,Culture,Easy,What do we call the way of life of people?,Culture is the way of life,Tradition,Culture,Religion,Custom,2
Mathematics,Fractions,Medium,What is 1/2 + 1/4?,Add fractions with common denominator,1/6,2/4,3/4,1/3,3
